[
  {
    "source": "web",
    "id": "sha256:web-fixture",
    "type": "web_page",
    "title": "Web fixture",
    "url": "https://example.com/docs",
    "text": "A bounded public-web fixture.",
    "author": null,
    "publishedAt": null,
    "contentHash": "sha256:1111111111111111111111111111111111111111111111111111111111111111",
    "adapterVersion": "0.3.0-alpha.2",
    "warnings": [],
    "metadata": { "depth": 0 },
    "provenance": { "retrievedAt": "2026-07-18T00:00:00.000Z", "method": "crawler", "authenticated": false, "credentialed": false }
  },
  {
    "source": "github",
    "id": "42",
    "type": "repository",
    "title": "example/project",
    "url": "https://github.com/example/project",
    "text": "Repository fixture.",
    "author": "example",
    "publishedAt": "2025-01-02T03:04:05.000Z",
    "contentHash": "sha256:2222222222222222222222222222222222222222222222222222222222222222",
    "adapterVersion": "0.3.0-alpha.2",
    "warnings": [],
    "metadata": { "stars": 7, "license": "MIT" },
    "provenance": { "retrievedAt": "2026-07-18T00:00:00.000Z", "method": "api", "authenticated": false, "credentialed": false }
  },
  {
    "source": "youtube",
    "id": "abcdefghijk",
    "type": "video",
    "title": "Video fixture",
    "url": "https://www.youtube.com/watch?v=abcdefghijk",
    "text": "",
    "author": "Fixture channel",
    "publishedAt": null,
    "contentHash": "sha256:3333333333333333333333333333333333333333333333333333333333333333",
    "adapterVersion": "0.3.0-alpha.2",
    "warnings": [],
    "metadata": { "metadataOnly": true, "transcriptAvailable": false },
    "provenance": { "retrievedAt": "2026-07-18T00:00:00.000Z", "method": "api", "authenticated": false, "credentialed": false }
  },
  {
    "source": "x",
    "id": "1893456789012345678",
    "type": "post",
    "title": "X fixture",
    "url": "https://x.com/fixture/status/1893456789012345678",
    "text": "X fixture",
    "author": "fixture",
    "publishedAt": "2025-06-07T08:09:10.000Z",
    "contentHash": "sha256:4444444444444444444444444444444444444444444444444444444444444444",
    "adapterVersion": "0.3.0-alpha.2",
    "warnings": [],
    "metadata": { "metrics": { "like_count": 8 } },
    "provenance": { "retrievedAt": "2026-07-18T00:00:00.000Z", "method": "api", "authenticated": true, "credentialed": true }
  },
  {
    "source": "reddit",
    "id": "abc123",
    "type": "post",
    "title": "Reddit fixture",
    "url": "https://www.reddit.com/r/testing/comments/abc123/fixture/",
    "text": "Reddit fixture body.",
    "author": "tester",
    "publishedAt": "2025-01-01T00:00:00.000Z",
    "contentHash": "sha256:5555555555555555555555555555555555555555555555555555555555555555",
    "adapterVersion": "0.3.0-alpha.2",
    "warnings": [],
    "metadata": { "subreddit": "testing", "commentsSample": [] },
    "provenance": { "retrievedAt": "2026-07-18T00:00:00.000Z", "method": "api", "authenticated": true, "credentialed": true }
  }
]
