{
  "source": "web",
  "id": "sha256:65cefce6a731c217f58676f21069cc58a96e361a7c1f3d8bee3fe46fb45900be",
  "type": "web_page",
  "title": "Offline Evidence Index",
  "url": "http://127.0.0.1:58324/",
  "text": "# Offline Evidence Index\n\nLocal fixture content for a real crawler workflow proof.\n\n[Evidence record](/evidence)",
  "author": null,
  "publishedAt": null,
  "contentHash": "sha256:268e32f4590b6695fb5ac1235b793ceee6389b4fc5c9dc2a3056055a8d1b6e33",
  "adapterVersion": "0.3.0-alpha.1",
  "warnings": [],
  "metadata": {
    "description": "Deterministic loopback fixture",
    "language": "en",
    "depth": 0,
    "contentHash": "sha256:65cefce6a731c217f58676f21069cc58a96e361a7c1f3d8bee3fe46fb45900be",
    "discoveredFrom": null,
    "redirectChain": []
  },
  "provenance": {
    "retrievedAt": "2026-07-17T22:54:48.350Z",
    "method": "crawler",
    "authenticated": false,
    "credentialed": false
  }
}
